{
  "$schema": "https://json-schema.org/draft/2020-12/schema",
  "$id": "fixture://schemas/runtime_checkpoint_record.schema.json",
  "title": "HADAF Runtime Checkpoint Record Fixture",
  "type": "object",
  "additionalProperties": false,
  "required": [
    "schema_version",
    "checkpoint_id",
    "box_id",
    "ffet_id",
    "product_sha",
    "tree_hash",
    "control_state_hash",
    "evidence_state_hash",
    "runtime_state_hash",
    "resume_part",
    "rollback_ref",
    "freshness_status",
    "cannot_claim"
  ],
  "properties": {
    "schema_version": {
      "const": "1.0.0"
    },
    "checkpoint_id": {
      "$ref": "fixture://schemas/h04_h06_lifecycle_common.definitions.schema.json#/$defs/id"
    },
    "box_id": {
      "$ref": "fixture://schemas/h04_h06_lifecycle_common.definitions.schema.json#/$defs/id"
    },
    "ffet_id": {
      "$ref": "fixture://schemas/h04_h06_lifecycle_common.definitions.schema.json#/$defs/id"
    },
    "product_sha": {
      "$ref": "fixture://schemas/h04_h06_lifecycle_common.definitions.schema.json#/$defs/gitObjectHash"
    },
    "tree_hash": {
      "$ref": "fixture://schemas/h04_h06_lifecycle_common.definitions.schema.json#/$defs/gitObjectHash"
    },
    "control_state_hash": {
      "$ref": "fixture://schemas/h04_h06_lifecycle_common.definitions.schema.json#/$defs/sha256"
    },
    "evidence_state_hash": {
      "$ref": "fixture://schemas/h04_h06_lifecycle_common.definitions.schema.json#/$defs/sha256"
    },
    "runtime_state_hash": {
      "$ref": "fixture://schemas/h04_h06_lifecycle_common.definitions.schema.json#/$defs/sha256"
    },
    "resume_part": {
      "type": "string"
    },
    "rollback_ref": {
      "$ref": "fixture://schemas/h04_h06_lifecycle_common.definitions.schema.json#/$defs/ref"
    },
    "freshness_status": {
      "$ref": "fixture://schemas/h04_h06_lifecycle_common.definitions.schema.json#/$defs/freshnessStatus"
    },
    "cannot_claim": {
      "$ref": "fixture://schemas/h04_h06_lifecycle_common.definitions.schema.json#/$defs/cannotClaim"
    }
  }
}
