{
  "schema_version": "1.0.0",
  "checkpoint_id": "checkpoint-H06-F02-stale-sha",
  "box_id": "H06",
  "ffet_id": "H06-F02",
  "product_sha": "f61843413444431eec925c3de0759a69552ad6e5",
  "tree_hash": "aa3d3d91f8c7c375dce5453511834f6203e392af",
  "control_state_hash": "1111111111111111111111111111111111111111111111111111111111111111",
  "evidence_state_hash": "2222222222222222222222222222222222222222222222222222222222222222",
  "runtime_state_hash": "3333333333333333333333333333333333333333333333333333333333333333",
  "resume_part": "PART-09:H06-F02",
  "rollback_ref": "product://commits/f61843413444431eec925c3de0759a69552ad6e5",
  "freshness_status": "fresh",
  "cannot_claim": [
    "production_resource_orchestration",
    "live_autonomous_worktree_orchestration",
    "mechanically_independent_agents",
    "stable_agents"
  ]
}
